"obj","museum","text","visual_item"
"http://data.silknow.org/object/540c3b7a-9bf8-30e5-963e-00e78022eb21","http://data.silknow.org/graph/cer","Tejido rectangular con fondo en color y decoración a base de capullos de flor en color verde.","http://data.silknow.org/vocabulary/743"
"http://data.silknow.org/object/540c3b7a-9bf8-30e5-963e-00e78022eb21","http://data.silknow.org/graph/cer","Edad Moderna","http://data.silknow.org/vocabulary/743"
"http://data.silknow.org/object/906f4796-5b9f-35bd-b33e-e5be503a13d5","http://data.silknow.org/graph/cer","Cenefa enmarcada en tres de sus lados, y recortada en el otro lado. Sobre fondo de terciopelo verde, tres piñas similares, intercaladas con otros motivos vegetales.","http://data.silknow.org/vocabulary/743"
"http://data.silknow.org/object/906f4796-5b9f-35bd-b33e-e5be503a13d5","http://data.silknow.org/graph/cer","Edad Contemporánea","http://data.silknow.org/vocabulary/743"
"http://data.silknow.org/object/857b5354-be5b-3c7b-9b5b-c48bf0da602c","http://data.silknow.org/graph/cer","Colcha de damasco color rojo con decoración floral. Remate de cortina del mismo tejido y decoración rematada en fleco. Dos tiras de damasco con forro de tafetán y un fragmento.","http://data.silknow.org/vocabulary/743"
"http://data.silknow.org/object/857b5354-be5b-3c7b-9b5b-c48bf0da602c","http://data.silknow.org/graph/cer","Edad Contemporánea","http://data.silknow.org/vocabulary/743"
"http://data.silknow.org/object/9fa70f01-21a8-3721-a8e7-4ae4565ff6ad","http://data.silknow.org/graph/cer","Época Luis XVI   Edad Moderna","http://data.silknow.org/vocabulary/743"
"http://data.silknow.org/object/9fa70f01-21a8-3721-a8e7-4ae4565ff6ad","http://data.silknow.org/graph/cer","Estilo Luis XVI.","http://data.silknow.org/vocabulary/743"
"http://data.silknow.org/object/9fa70f01-21a8-3721-a8e7-4ae4565ff6ad","http://data.silknow.org/graph/cer","Asiento de planta trapezoidal, respaldo plano con remate ""de chapeaux"" y motivo de cinta. Patas en forma de estípites acanaladas, con molduras clásicas por arriba y por abajo, y cuatro tacos cúbicos con flores a cada lado. El contorno del respaldo y del asiento están recorridos por sencillas estrías. Tapizado en asiento y respaldo, con fondo rojo, y motivos de acantos y flores sobre fondo beige.","http://data.silknow.org/vocabulary/743"
"http://data.silknow.org/object/1294f981-808a-312d-b656-2dbe3769fc35","http://data.silknow.org/graph/cer","Estilo Luis XVI.","http://data.silknow.org/vocabulary/743"
"http://data.silknow.org/object/1294f981-808a-312d-b656-2dbe3769fc35","http://data.silknow.org/graph/cer","Época Luis XVI","http://data.silknow.org/vocabulary/743"
"http://data.silknow.org/object/1294f981-808a-312d-b656-2dbe3769fc35","http://data.silknow.org/graph/cer","Asiento de planta trapezoidal, respaldo plano con remate ""de chapeaux"" y motivo de cinta. Patas en forma de estípites acanaladas, con molduras clásicas por arriba y por abajo, y cuatro tacos cúbicos con flores a cada lado. El contorno del respaldo y del asiento están recorridos por sencillas estrías. Tapizado en asiento y respaldo, con fondo rojo, y motivos de acantos y flores sobre fondo beige.","http://data.silknow.org/vocabulary/743"
"http://data.silknow.org/object/e74fb7b4-7b78-30bf-824c-6ddc0dffb624","http://data.silknow.org/graph/cer","Época Luis XVI","http://data.silknow.org/vocabulary/743"
"http://data.silknow.org/object/e74fb7b4-7b78-30bf-824c-6ddc0dffb624","http://data.silknow.org/graph/cer","Esta silla es de estilo Luis XVI.","http://data.silknow.org/vocabulary/743"
"http://data.silknow.org/object/e74fb7b4-7b78-30bf-824c-6ddc0dffb624","http://data.silknow.org/graph/cer","Asiento de planta trapezoidal, respaldo plano con remate ""de chapeaux"" y motivo de cinta. Patas en forma de estípites acanaladas, con molduras clásicas por arriba y por abajo, y cuatro tacos cúbicos con flores a cada lado. El contorno del respaldo y del asiento están recorridos por sencillas estrías. Tapizado en asiento y respaldo, con fondo rojo, y motivos de acantos y flores sobre fondo beige.","http://data.silknow.org/vocabulary/743"
"http://data.silknow.org/object/41f86146-5f0d-3e7c-88d8-9ac457a94190","http://data.silknow.org/graph/cer","Edad Contemporánea","http://data.silknow.org/vocabulary/743"
"http://data.silknow.org/object/41f86146-5f0d-3e7c-88d8-9ac457a94190","http://data.silknow.org/graph/cer","Sofá de madera tallada y dorada con respaldo y asiento ovalado, cuatro pares de patas en forma de estípites acanalados. Brazos curvos rematados en volutas. Los brazos y soportes van estriados. Tapicería en seda rosa palo.","http://data.silknow.org/vocabulary/743"
"http://data.silknow.org/object/41f86146-5f0d-3e7c-88d8-9ac457a94190","http://data.silknow.org/graph/cer","Canapé de estilo Luis XVI.","http://data.silknow.org/vocabulary/743"
"http://data.silknow.org/object/de5f6701-dd88-382c-830c-eff688f123c8","http://data.silknow.org/graph/cer","Edad Moderna","http://data.silknow.org/vocabulary/743"
"http://data.silknow.org/object/de5f6701-dd88-382c-830c-eff688f123c8","http://data.silknow.org/graph/cer","Casulla de damasco color blanco con cenefas en terciopelo rojo. Reborde que remata toda la pieza también de terciopelo. Damasco con decoración floral en línea vertical ondulada. Rematado con fleco en seda roja y amarilla.","http://data.silknow.org/vocabulary/743"
"http://data.silknow.org/object/10026a94-2699-35b3-9270-5fa13ca677db","http://data.silknow.org/graph/cer","Edad Moderna","http://data.silknow.org/vocabulary/743"
"http://data.silknow.org/object/10026a94-2699-35b3-9270-5fa13ca677db","http://data.silknow.org/graph/cer","Seda brochada verde con pequeños motivos florales distribuidos en líneas verticales con inclinación alterna. En la espalda la cenefa central es de damasco azul con motivos florales. Falta la cenefa delantera. Galón estrecho y sencillo de seda blanca. Forro de percal verde de la época.","http://data.silknow.org/vocabulary/743"
"http://data.silknow.org/object/3783e14e-7eb6-3fe6-bd89-ec45d7726dd1","http://data.silknow.org/graph/cer","Hay dos manipulos hechos con el mismo tejido de la casulla, pero rematados con flecos de seda rosa y dos verdes con el nº inv 6344 y 6345.","http://data.silknow.org/vocabulary/743"
"http://data.silknow.org/object/3783e14e-7eb6-3fe6-bd89-ec45d7726dd1","http://data.silknow.org/graph/cer","Edad Moderna","http://data.silknow.org/vocabulary/743"
"http://data.silknow.org/object/3783e14e-7eb6-3fe6-bd89-ec45d7726dd1","http://data.silknow.org/graph/cer","Sólo conserva cuatro tallas sobre el forro. Estas son de seda valenciana con motivos florales grandes en rojos, verdes y azules distribuidos en franjas muy acusadas en el envés. Galón dorado de la época. Forro de lienzo.","http://data.silknow.org/vocabulary/743"
"http://data.silknow.org/object/75c38c0b-19eb-33ca-b6c3-db880d189c1a","http://data.silknow.org/graph/cer","Abanico de baraja,.  
  
Varillaje: 18 varillas + 2 guardas de nácar madreperla, caladas ,grabadas y  unidas por una cinta de seda en su color de 5 mm de ancha.   
Clavillo:  remachado sobre virola de nácar, con anilla de metal plateado con borla con pasamanería e hilos de seda en su color.  
  
Cara: bandas paralelas y concéntricas con elementos vegetales y flores. Las varillas van de dos en dos para formar la decoración. Por encima de la cinta, un círculo y una flor en el interior de cada una de las varillas que se rematan en forma de ondas.   
Guardas: motivos similares a los del varillaje.  
Revés: se cala la cara.","http://data.silknow.org/vocabulary/743"
"http://data.silknow.org/object/75c38c0b-19eb-33ca-b6c3-db880d189c1a","http://data.silknow.org/graph/cer","Edad Contemporánea","http://data.silknow.org/vocabulary/743"
"http://data.silknow.org/object/5ebc588b-b517-3a36-a77f-9401c02cd75b","http://data.silknow.org/graph/cer","Edad Contemporánea","http://data.silknow.org/vocabulary/743"
"http://data.silknow.org/object/5ebc588b-b517-3a36-a77f-9401c02cd75b","http://data.silknow.org/graph/cer","Abanico plegable con plumas.  
  
País: simple de plumas blancas de ganso unidas por un hilo, pintadas a la aguada y con oro y rematadas con plumas de pavo real.   
Varillaje:  20 varillas + 2 guardas de hueso calado, calada y con plata corlada.   
Clavillo: remachado sobre virola de nácar madreperla, con anilla anilla lobulada  de  latón de la que pende un doble cordón con pasamanería; borla recubierta de plata dorada, hilos entorchados dorados e hilos de seda de color salmón (12 cm).  
  
Cara: un gran ramillete de flores (rosas y margaritas), en disposición horizontal, ocupa la casi totalidad de las plumas, a ambos lados, y como remate en la parte superior motivos vegetales en oro.  
Revés: carece de decoración.  
   
Fuente:decorada con motivos vegetales calados y plata corlada (alternando 2,1,2).   
Guardas:la parte inferior  tienen forma de balaustre con una hoja de plata corlada en el centro y la superior con motivos vegetales calados, rodeado por una filamento de plata corlada con dos hojas en la cúspide y otra en el centro.   
Revés: sin decoración.","http://data.silknow.org/vocabulary/743"
"http://data.silknow.org/object/5ebc588b-b517-3a36-a77f-9401c02cd75b","http://data.silknow.org/graph/cer","Aunque la parte superior de este abanico es parecida a los abanicos orientales (cuya bibliografía se adjunta) el varillaje es europeo, presentando similitudes con los varillajes isabelinos. Según Maryse Volet está realizado en Europa en torno a 1850.  
  
Bibliografía comparada:  
- Chine-Chinoiseries au Chateau de Maison. Catalogue de l´exposition, 27 novembre 2005-15 janvier 2006. París, Cercle de l´eventail, pp. .83 a 87,  nº 55,56,57 y 58.  
- RODRIGO ZARZOSA, Carmen: Colección de abanicos del Museo Nacional de Cerámica. Valencia, Ministerio de Educación y Cultura, 2000, p.160, nº 100.","http://data.silknow.org/vocabulary/743"
"http://data.silknow.org/object/0d698a24-5d93-38b3-b860-20543693320b","http://data.silknow.org/graph/cer","Abanico de luto con decoración floral  de estilo modernista.  
Abanico parecido a los nº: 4994, 4997 y 5000  
  
Bibliografía comparada:  
-El abanico español: La colección del Marqués de Colomina, cat.exp. Valencia, Ministerio de Cultura,  2008, p. 96, nº 33.  
-FÄCHER.  Kunst und Mode aus fünf Jahrhunderten. München,  Hirmer Verlag. [Exposición celebrada en Alemania del 26 de junio al 4 de octubre de 1987, organizada por Herausgegeben vom Bayerischen Nationalmuseum] , 1987, p. 209, nº 94.","http://data.silknow.org/vocabulary/743"
"http://data.silknow.org/object/0d698a24-5d93-38b3-b860-20543693320b","http://data.silknow.org/graph/cer","Abanico plegable. País doble. Varillaje 14+2 de nácar negro. Clavillo rematado en strass y engastado en caja de metal con falsas garras.","http://data.silknow.org/vocabulary/743"
"http://data.silknow.org/object/0d698a24-5d93-38b3-b860-20543693320b","http://data.silknow.org/graph/cer","Edad Contemporánea [Modernismo]","http://data.silknow.org/vocabulary/743"
"http://data.silknow.org/object/0cd0e76c-ff07-3094-ac62-8da989e8caaf","http://data.silknow.org/graph/cer","Época  Alfonsina   Edad Contemporánea","http://data.silknow.org/vocabulary/743"
"http://data.silknow.org/object/0cd0e76c-ff07-3094-ac62-8da989e8caaf","http://data.silknow.org/graph/cer","Silla de brazos de tamaño reducido con acabado policromado de color azul-verdoso claro, con elementos decorativos pintados y dorados. El tapizado del respaldo es un fragmento de tejido de seda de color azul del siglo XVIII reutilizado.  
Estructura de bastidor de madera  con uniones a ranura y lengüeta con clavijas. El montante trasero inclinado ligeramente hacia atrás a la altura de la pata y del respaldo; alternancia de elementos prismáticos (pies y partes de unión) con elementos torneados en forma de balaustre, y remate torneado. Las patas frontales en cabriolé con pies ""club foot"". Chambrana en forma de ""H"" con travesaños torneados en forma de balaustre con las partes de unión prismáticas. Cintura de travesaños corridos de madera de conífera, que forman el bastidor del asiento de chasis, provisto de taquetes en los ángulos. Al frente, faldón con su canto inferior recortado y moldado, formando disposición simétrica de ""C´"" alrededor de una forma de mandorla central. El respaldo formado por dos travesaños entre los montantes, unidos con dos más montantes al interior, que forman el marco para el tapizado. Los travesaños están recortados en sus lados exteriores, con las esquinas redondeadas y el centro apuntado hacia fuera; el superior presenta remate de talla calada en forma de dos ""S"" tumbadas con ""C"" superpuestas, alrededor de un fragmento de palmeta central. Brazos cortos curvos hacia fuera terminados en volutas. El asiento tapizado con raso  de algodón de color azul-verdoso, que se utiliza también en el anverso del respaldo, cuyo frente está tapizado con un fragmento de tejido de seda de finales del siglo XVIII reutilizado. El claveteado cubierto por una cenefa de pasamanería con ovas encadenadas, de color azul claro, moderno. La silla está acabada con policromía de color azul-verdoso claro, que presenta motivos pintados a pincel en colores azul marino, azul claro, rosa, rojo, y verde. Elementos aislados con dorado a la purpurina, como los discos y elementos en forma de bola entre los torneados de balaustre, el borde inferior del faldón, la molduración del recuadro central del respaldo, y la palmeta del copete del respaldo.  
En cuanto a la decoración, entre los elementos aislados pintados, se encuentran sendas aves exóticas en los elementos prismáticos superiores de los montantes del respaldo, ramilletes con aves exóticos en la parte superior de las patas, y ramilletes de flores en los elementos prismáticos inferiores del respaldo, en el apoyo de los brazos, en los elementos torneados de balaustre, en el faldón frontal y el travesaño central de la chambrana.","http://data.silknow.org/vocabulary/743"
"http://data.silknow.org/object/ce3cadef-4fba-3608-9056-4b683e9f4de3","http://data.silknow.org/graph/cer","Silla de madera tallada y policromada. Respaldo ovalado con copete. Pata en forma de estípites acanalados.  Con motivos florales, rosas rojas, como decoración.","http://data.silknow.org/vocabulary/743"
"http://data.silknow.org/object/ce3cadef-4fba-3608-9056-4b683e9f4de3","http://data.silknow.org/graph/cer","Edad Contemporánea","http://data.silknow.org/vocabulary/743"
"http://data.silknow.org/object/ce3cadef-4fba-3608-9056-4b683e9f4de3","http://data.silknow.org/graph/cer","Época Luis XVI.","http://data.silknow.org/vocabulary/743"
"http://data.silknow.org/object/7c4d01f4-19f5-3d90-8503-06892f128344","http://data.silknow.org/graph/cer","Estilo Isabelino, imitando vagamente al Neoclásico","http://data.silknow.org/vocabulary/743"
"http://data.silknow.org/object/7c4d01f4-19f5-3d90-8503-06892f128344","http://data.silknow.org/graph/cer","Edad Contemporánea","http://data.silknow.org/vocabulary/743"
"http://data.silknow.org/object/7c4d01f4-19f5-3d90-8503-06892f128344","http://data.silknow.org/graph/cer","Silla muy sencilla con asiento trapezoidal. Tapizado en seda color oro y con decoración floreada. Respaldo calado casi rectangular, con la barra más ancha que la cintura. Su adorno central, encerrado dentro de un rectángulo, está formado por un jarrón con plantas estilizado, enmarcado por un óvalo con dos pequeño círculos y colocado sobre un pedestal con adornos formados por incisiones de punzón. Patas prismáticas con dos travesaños y dos chambranas, una trasera y otras casi central.","http://data.silknow.org/vocabulary/743"
"http://data.silknow.org/object/896d747b-6245-3f6b-8549-9b6c4d76a07f","http://data.silknow.org/graph/cer","Seda roja brochada con florón y hojas en plata en grandes motivos. Galón seda amarillo y plata. Conserva el cordón con fijador y la borla en seda amarilla y plata.","http://data.silknow.org/vocabulary/743"
"http://data.silknow.org/object/896d747b-6245-3f6b-8549-9b6c4d76a07f","http://data.silknow.org/graph/cer","Edad Moderna","http://data.silknow.org/vocabulary/743"
"http://data.silknow.org/object/7e97783c-0cdc-3e11-9748-b02d6e6d2b15","http://data.silknow.org/graph/cer","Este manípulo y otro igual con número de inventario 6345 están realizados con el mismo tejido que la casulla número de inventario 4770. Rematados con fleco de seda (la casulla rematada con galón metalico).","http://data.silknow.org/vocabulary/743"
"http://data.silknow.org/object/7e97783c-0cdc-3e11-9748-b02d6e6d2b15","http://data.silknow.org/graph/cer","Edad Moderna","http://data.silknow.org/vocabulary/743"
"http://data.silknow.org/object/7e97783c-0cdc-3e11-9748-b02d6e6d2b15","http://data.silknow.org/graph/cer","Decoración de motivos florales grandes en rojo, verde y azul. Rematado con fleco de seda.","http://data.silknow.org/vocabulary/743"
"http://data.silknow.org/object/79c728b7-4198-3b00-8ddb-b290d2c4959a","http://data.silknow.org/graph/cer","Edad Moderna","http://data.silknow.org/vocabulary/743"
"http://data.silknow.org/object/79c728b7-4198-3b00-8ddb-b290d2c4959a","http://data.silknow.org/graph/cer","Este manípulo y otro igual con el número de inventario 6344 están realizados con el mismo tejido que la casulla número de inventario 4770. Rematados con fleco de seda (la casulla rematada con galón metalico).","http://data.silknow.org/vocabulary/743"
"http://data.silknow.org/object/79c728b7-4198-3b00-8ddb-b290d2c4959a","http://data.silknow.org/graph/cer","Decoración de motivos florales grandes en rojo, verde y azul. Rematado con fleco de seda.","http://data.silknow.org/vocabulary/743"
"http://data.silknow.org/object/d3bdbd6a-cedb-3392-bac0-2e2e009401ba","http://data.silknow.org/graph/cer","Edad Moderna","http://data.silknow.org/vocabulary/743"
"http://data.silknow.org/object/d3bdbd6a-cedb-3392-bac0-2e2e009401ba","http://data.silknow.org/graph/cer","Brocado de seda crema con hilo metálico dorado, rizado en el fondo, liso y en laminilla en la decoración. Ésta consiste en pequeñas flores brocadas en seda carmín y verde en los tallos. La composición general no puede definirse. Ancho galón dorado en los extremos. Forro de groguen de seda rojo carmín.","http://data.silknow.org/vocabulary/743"
"http://data.silknow.org/object/d3bdbd6a-cedb-3392-bac0-2e2e009401ba","http://data.silknow.org/graph/cer","Esta pieza corresponde a la antigua ficha 3502 que describe ""Un manípulo"". Esta ficha escrita a máquina está fechada en la década de 1930, y corresponde al periodo en el que Luis Pérez Bueno fue director del museo. El objeto procede de la colección personal de Luis Pérez Bueno.","http://data.silknow.org/vocabulary/743"
"http://data.silknow.org/object/3308418c-b5e0-3783-881e-471af3563d64","http://data.silknow.org/graph/cer","Edad Contemporánea","http://data.silknow.org/vocabulary/743"
"http://data.silknow.org/object/3308418c-b5e0-3783-881e-471af3563d64","http://data.silknow.org/graph/cer","Fragmento de tejido semicircular. Sobre fondo blanco, presenta una decoración floral y vegetal en seda de distintos colores e hilo metálico. Conserva en todo el perímetro exterior un remate de encaje de hilo metálico dorado. La pieza está formada por tres fragmentos. El forro ha sido retirado y se pueden apreciar los orillos que ha conservado la pieza central.   
Ligamentos:  
-Tafetán [base]  
-Tramas espolinadas [decoración]","http://data.silknow.org/vocabulary/743"
"http://data.silknow.org/object/c2e9a78c-0a34-3d98-911c-92a08ea13725","http://data.silknow.org/graph/cer","La Dra. Lesley Miller, conservadora de tejidos del Victoria & Albert Museum, lo considera una producción de las manufacturas inglesas de Norwich del siglo XVIII","http://data.silknow.org/vocabulary/743"
"http://data.silknow.org/object/c2e9a78c-0a34-3d98-911c-92a08ea13725","http://data.silknow.org/graph/cer","Tejido de color azul con decoración floral. Todo el tejido está completamente decorado con flores grises sobre las que hay ramilletes de flores rojas.","http://data.silknow.org/vocabulary/743"
"http://data.silknow.org/object/c2e9a78c-0a34-3d98-911c-92a08ea13725","http://data.silknow.org/graph/cer","Edad Moderna","http://data.silknow.org/vocabulary/743"
"http://data.silknow.org/object/c29d5453-e2a1-324e-98e7-6d3bf68b8e16","http://data.silknow.org/graph/cer","Edad Contemporánea","http://data.silknow.org/vocabulary/743"
"http://data.silknow.org/object/c29d5453-e2a1-324e-98e7-6d3bf68b8e16","http://data.silknow.org/graph/cer","Mantón cuadrangular de seda en blanco, decoración bordada en negro con flores de distintos tamaños y rodeado por una cenefa en negro. Motivos repetidos en cuadrantes. Fleco blanco.","http://data.silknow.org/vocabulary/743"
"http://data.silknow.org/object/1ef62c92-5434-3f8a-b4e7-d563510fde91","http://data.silknow.org/graph/cer","Dinastía Qing","http://data.silknow.org/vocabulary/743"
"http://data.silknow.org/object/1ef62c92-5434-3f8a-b4e7-d563510fde91","http://data.silknow.org/graph/cer","Cuatro colgantes: dos bolsas de tabaco con forma de venera en seda bordada con motivos florales y dos bolsas de abanico de forma alargada en seda de color naranja con aplicaciones textiles formando motivos florales. Las sujeciones del cinturón están formadas por cordoncillos de color beige con cuentas azules intercaladas. La hebilla del cinturón es de metal dorado de forma elipsoidal con decoración floral y restos de esmalte azul.","http://data.silknow.org/vocabulary/743"
"http://data.silknow.org/object/8ea86027-0d23-39b7-9c75-471da397988c","http://data.silknow.org/graph/cer","Dinastía Qing","http://data.silknow.org/vocabulary/743"
"http://data.silknow.org/object/8ea86027-0d23-39b7-9c75-471da397988c","http://data.silknow.org/graph/cer","Zapatos para una niña con pies vendados, que deformaban su crecimiento. Los pies pequeños eran señal de alto estatus en la sociedad china, y al mismo tiempo condicionaban andar con pasos muy pequeños, lo que se consideraba atractivo.","http://data.silknow.org/vocabulary/743"
"http://data.silknow.org/object/8ea86027-0d23-39b7-9c75-471da397988c","http://data.silknow.org/graph/cer","Zapato del pie derecho, de raso azul celeste, con bordado al pasado en hilos de seda verde, amarillo y rosa claro, con motivos florales. Abierto por delante y forrado en lienzo blanco. En el borde lleva una primera cenefa en negro, otra de hilos de plata y una tercera en verde con un pequeño tacón de tafetán blanco bordado con flores estilizadas en azul, suela de lienzo blanco y punta de seda azul clara.","http://data.silknow.org/vocabulary/743"
"http://data.silknow.org/object/6bfe171c-5601-345d-8b2a-fb63bb853cc9","http://data.silknow.org/graph/cer","Dinastía Qing","http://data.silknow.org/vocabulary/743"
"http://data.silknow.org/object/6bfe171c-5601-345d-8b2a-fb63bb853cc9","http://data.silknow.org/graph/cer","Zapato del pie izquierdo, de raso azul celeste, con bordado al pasado en hilos de seda verde, amarillo y rosa claro, con motivos florales. Abierto por delante y forrado en lienzo blanco. En el borde lleva una primera cenefa en negro, otra de hilos de plata y una tercera en verde con un pequeño tacón de tafetán blanco bordado con flores estilizadas en azul, suela de lienzo blanco y punta de seda azul clara.","http://data.silknow.org/vocabulary/743"
"http://data.silknow.org/object/6bfe171c-5601-345d-8b2a-fb63bb853cc9","http://data.silknow.org/graph/cer","Zapatos para una niña con pies vendados, que deformaban su crecimiento. Los pies pequeños eran señal de alto estatus en la sociedad china, y al mismo tiempo condicionaban andar con pasos muy pequeños, lo que se consideraba atractivo.","http://data.silknow.org/vocabulary/743"
"http://data.silknow.org/object/90427c5c-9898-3cdb-8c96-393d616557c4","http://data.silknow.org/graph/cer","Abanico de baraja.  
  
Varillaje: 16 varillas + 2 guardas (más gruesas) de marfil pìntadas a la aguada en tonos pasteles (propios del modernismo), y  unidas en la parte superior por una cinta de  tafetán de seda en su color.   
Clavillo: rematado con un botón de marfil sobre anilla l con doble curva, de la que pende un doble  cordón de seda  en su color, abrazadera de cordón trenzado y al final una borla con trabajo de pasamanería, también de seda en su color, de la que penden hilos de seda.  
  
Cara: decoración floral; dos ramilletes de flores: el de la izquierda  compuesto por flores   
rosas  rosa abiertas, capullos y hojas  y el del centro-derecha con margaritas,  sobre trece varillas. El resto de las varillas  y las guardas sin decoración.  
Revés: sin decoración.","http://data.silknow.org/vocabulary/743"
"http://data.silknow.org/object/90427c5c-9898-3cdb-8c96-393d616557c4","http://data.silknow.org/graph/cer","Modernismo   Edad Contemporánea","http://data.silknow.org/vocabulary/743"
"http://data.silknow.org/object/90427c5c-9898-3cdb-8c96-393d616557c4","http://data.silknow.org/graph/cer","Al igual que el abanico con nº de  inv 17470, está realizado en Austria, por su decoración, por el trabajo de pasamanería. La anilla que en Japón suele ser de plata aquí  es de marfil.  
Es importante porque conserva la abrazadera.  
  
Bbliiografía comparada:   
ARNSTRONG, Nancy: The Book of the Fans. London, Colour Library International, 1978, p. 119.  
-FILIPPINI SACHETTO, Amalia; TESTONI SASSI, Lidia: Un soffio di vanità. Ventagli da collezione private italiane, Padova, De Luca Edizioni d´Arte, 1989, p. 113, nº 104  
-RODRIGO ZARZOSA, Carmen. Colección de abanicos en el Museo Nacional de Cerámica. Catálogo - Exposición. Madrid, Ministerio de Educación y Cultura, 2000, p. 141, nº 75.  
-VOLET, Maryse; BEENTJES, Annette: Éventails, Collection du Musée d´ art et d´ histoire de Genéve. Genéve.  Editions Clairfontaine, 1987, p. 144, nº 110.","http://data.silknow.org/vocabulary/743"
